title,selftext,post
Team of telescopes finds X-ray engine inside mysterious supernova,,Team of telescopes finds X-ray engine inside mysterious supernova 
"Tuesday's 2018 Buchalter Cosmology Prize 1st place goes to ""A Cosmological Signature of the Standard Model Higgs Vacuum Instability: Primordial Black Holes as Dark Matter""",,"Tuesday's 2018 Buchalter Cosmology Prize 1st place goes to ""A Cosmological Signature of the Standard Model Higgs Vacuum Instability: Primordial Black Holes as Dark Matter"" "
Giant pattern discovered in the clouds of planet Venus - Infrared cameras and supercomputer simulations break through Venus' veil,,Giant pattern discovered in the clouds of planet Venus - Infrared cameras and supercomputer simulations break through Venus' veil 
Looking through Binoculars with Glasses,"I have a pair of Celestron Cometron 7x50 binoculars and I have trouble seeing things through them. I wear glasses and I'm wondering if they are affecting matters. When I try to look at the Moon, it looks doubled and fuzzy and I have them up at the highest magnification, so I'm wondering what's going on. Any suggestions?","Looking through Binoculars with Glasses I have a pair of Celestron Cometron 7x50 binoculars and I have trouble seeing things through them. I wear glasses and I'm wondering if they are affecting matters. When I try to look at the Moon, it looks doubled and fuzzy and I have them up at the highest magnification, so I'm wondering what's going on. Any suggestions?"
Unable to see Orion nebula with binoculars,"I have an olympus 8x42 dpsi binocular that I use mainly for birding. I sometimes use it to look at the night's sky. While looking at Orion's sword, I think, I just see 3 pair of twin stars. I see  three set of two close stars. I think the one in middle should be the nebula, but I am unable to see any nebulous area, just dots of light. I stay in a very light polluted city. What am I doing wrong ? Is the binocular not strong enough ? OR is the light pollution ?  I was reading 'Astronomy With An Opera-Glass' few weeks ago and I think, the writer says that the nebula could be seen by an opera glass!!","Unable to see Orion nebula with binoculars I have an olympus 8x42 dpsi binocular that I use mainly for birding. I sometimes use it to look at the night's sky. While looking at Orion's sword, I think, I just see 3 pair of twin stars. I see  three set of two close stars. I think the one in middle should be the nebula, but I am unable to see any nebulous area, just dots of light. I stay in a very light polluted city. What am I doing wrong ? Is the binocular not strong enough ? OR is the light pollution ?  I was reading 'Astronomy With An Opera-Glass' few weeks ago and I think, the writer says that the nebula could be seen by an opera glass!!"
Astronomers Use Annihilated Star to Clock Black Hole’s Spin,,Astronomers Use Annihilated Star to Clock Black Hole’s Spin 
Thought this would be appreciate by fellow space lovers.,,Thought this would be appreciate by fellow space lovers. 
Camera on Hubble Space Telescope Currently Offline Due to Hardware Problem,,Camera on Hubble Space Telescope Currently Offline Due to Hardware Problem 
What is GJ1214b's atmosphere composed of?,"So, if you didn't know the name or forgot it, it's an exoplanet composed of mostly water orbiting a red dwarf called Gliese 1214. about 42 light-years from earth. (As you can tell I love this planet). Anyways, I'd like to know what exactly the atmosphere is composed of. The only thing I've read about it's atmosphere is that it contains a lot of water vapor, but I highly doubt it's ONLY made of water vapor. I'm just curious, what is it made of? or do we not know?","What is GJ1214b's atmosphere composed of? So, if you didn't know the name or forgot it, it's an exoplanet composed of mostly water orbiting a red dwarf called Gliese 1214. about 42 light-years from earth. (As you can tell I love this planet). Anyways, I'd like to know what exactly the atmosphere is composed of. The only thing I've read about it's atmosphere is that it contains a lot of water vapor, but I highly doubt it's ONLY made of water vapor. I'm just curious, what is it made of? or do we not know?"
"Astronomers uncover ""Orion's Dragon"" within the nearest star-forming region to Earth: Orion's Nebula",,"Astronomers uncover ""Orion's Dragon"" within the nearest star-forming region to Earth: Orion's Nebula "
The CHIME telescope detects 13 more Fast Radio Bursts (FRBs) and one more repeating FRB. At full sensitivity the telescope will potentially detect dozens of FRBs a day.,,The CHIME telescope detects 13 more Fast Radio Bursts (FRBs) and one more repeating FRB. At full sensitivity the telescope will potentially detect dozens of FRBs a day. 
"Human eyes found new Kepler planet, &amp; it may be habitable",,"Human eyes found new Kepler planet, &amp; it may be habitable "
New BGU System Produces High-Res Images at Low Cost,,New BGU System Produces High-Res Images at Low Cost 
Messier 38 - Open Cluster in Auriga,,Messier 38 - Open Cluster in Auriga 
"This meteor, entering the atmosphere in one image and burning up in the next.",,"This meteor, entering the atmosphere in one image and burning up in the next. "
If not shared already. :),,If not shared already. :) 
"NASA’s TESS Mission Announces New Planets, Supernovae",,"NASA’s TESS Mission Announces New Planets, Supernovae "
"The Sun on 2019-01-03, with Sunspot 2732 and a nice prominence.",,"The Sun on 2019-01-03, with Sunspot 2732 and a nice prominence. "
Huge asteroid zipping by Earth has its own moon,,Huge asteroid zipping by Earth has its own moon 
Anyone know how to use this? Is it just decorative?,,Anyone know how to use this? Is it just decorative? 
"As someone always in search of clearer skies, I found this pretty neat!",,"As someone always in search of clearer skies, I found this pretty neat! "
I just finished writing my article about tying Astronomy and Artificial Intelligence together,"Hopefully, this will lead fellow astronomers towards data science and machine learning. lmk what you guys think! :)

[https://medium.com/@jeraldydcascayan/astronomical-skynet-8a65b7fcb34c](https://medium.com/@jeraldydcascayan/astronomical-skynet-8a65b7fcb34c)","I just finished writing my article about tying Astronomy and Artificial Intelligence together Hopefully, this will lead fellow astronomers towards data science and machine learning. lmk what you guys think! :)

[https://medium.com/@jeraldydcascayan/astronomical-skynet-8a65b7fcb34c](https://medium.com/@jeraldydcascayan/astronomical-skynet-8a65b7fcb34c)"
"The blue ball that is Neptune will be visible in the southwestern sky tonight after darkness falls, though you'll need binoculars to spot it.",,"The blue ball that is Neptune will be visible in the southwestern sky tonight after darkness falls, though you'll need binoculars to spot it. "
"Another Day, Another Exoplanet: NASA’s TESS Keeps Counting More.",,"Another Day, Another Exoplanet: NASA’s TESS Keeps Counting More. "
"Is it correct from a scientific perspective to call other natural satellites, other than our own, ""moons"" ? Google gives me conflicting views, that's why I'm asking here.","So I was thinking if it's accurate to call the natural satellites of other planets ""moons"". Also, I've seen people reffering to star systems as ""solar systems"". Is this accurate and correct ? 

Thank you :)","Is it correct from a scientific perspective to call other natural satellites, other than our own, ""moons"" ? Google gives me conflicting views, that's why I'm asking here. So I was thinking if it's accurate to call the natural satellites of other planets ""moons"". Also, I've seen people reffering to star systems as ""solar systems"". Is this accurate and correct ? 

Thank you :)"
Simeis 147 Supernova Remnant,,Simeis 147 Supernova Remnant 
Cygnus Milky way,,Cygnus Milky way 
Map of the moon that I drew by myself.,,Map of the moon that I drew by myself. 
"Astronomers estimate that a nearby galaxy, the Large Magellanic Cloud, will slam into the Milky Way and could knock our solar system far into the cosmic void. But a by-product of the collision with the LMC is it will delay the Milky Way's collision with the Andromeda galaxy by about a billion years.",,"Astronomers estimate that a nearby galaxy, the Large Magellanic Cloud, will slam into the Milky Way and could knock our solar system far into the cosmic void. But a by-product of the collision with the LMC is it will delay the Milky Way's collision with the Andromeda galaxy by about a billion years. "
Objects that subtended the greatest arc in the sky,"Does anyone know of a sky map or better yet a photoshopped picture of the night sky with all the large objects (by subtended arc).  I am thinking of something similar to the one you always see if the moon and the Andromeda galaxy except more complete for the entire sky.  

If that isn’t available even a list of the top twenty or so would be interesting.","Objects that subtended the greatest arc in the sky Does anyone know of a sky map or better yet a photoshopped picture of the night sky with all the large objects (by subtended arc).  I am thinking of something similar to the one you always see if the moon and the Andromeda galaxy except more complete for the entire sky.  

If that isn’t available even a list of the top twenty or so would be interesting."
Orion from a dark sky area,,Orion from a dark sky area 
Messier 45 - Pleiades Star Cluster,,Messier 45 - Pleiades Star Cluster 
Who are the best astronomers/astrophysicists to follow in twitter?,"Looking for some of the top scientists that share personal commentary and debate on issues related to space, astronomy and quantum mechanics.  Sort of like the tone of Neil De Grasse's twitter or the ""Started with a Bang"" blog by Ethan Siegel. A good balance between informative and entertaining. ","Who are the best astronomers/astrophysicists to follow in twitter? Looking for some of the top scientists that share personal commentary and debate on issues related to space, astronomy and quantum mechanics.  Sort of like the tone of Neil De Grasse's twitter or the ""Started with a Bang"" blog by Ethan Siegel. A good balance between informative and entertaining. "
Coma Galaxy Cluster,,Coma Galaxy Cluster 
Dates of solar and lunar eclipses in 2019,,Dates of solar and lunar eclipses in 2019 
Questions for Dr. Paul LaViolette interview...,"Ill be interviewing Dr. Paul this coming Monday night... www.mikehagan.com/main.htm 
I'm putting together some stuff for the show and thought I'd ask the community here for potential questions... 
The show will be streaming live Monday night 1/7/2019 from 11pm - 2am CST at: www.kopn.org
Cheers!
o)&lt;
mike","Questions for Dr. Paul LaViolette interview... Ill be interviewing Dr. Paul this coming Monday night... www.mikehagan.com/main.htm 
I'm putting together some stuff for the show and thought I'd ask the community here for potential questions... 
The show will be streaming live Monday night 1/7/2019 from 11pm - 2am CST at: www.kopn.org
Cheers!
o)&lt;
mike"
The Pictures are Here! New Horizons Close Up View of 2014 MU69,,The Pictures are Here! New Horizons Close Up View of 2014 MU69 
Messier 37 - Open Cluster in Auriga,,Messier 37 - Open Cluster in Auriga 
"Need anyone with a &gt;5 inch telescope from Washington/northern Idaho/Wyoming for an occultation on 2019/02/16, no experience required!","Hey everyone, after the (somewhat successful) observation of the asteroid 2015 TG387 on October 20, I would like to once again ask publically if anyone is interested and available to observe a new object: the unusual asteroid 944 Hidalgo. Just to give some background, it's a very strange asteroid whose orbit takes it from just inside the asteroid belt to almost the orbit of Saturn. It has a strangely comet-like orbit, and scientists think that it used to be a comet at some point that already lost all of its ice and dust.

In the early morning of February 16, just after it reached its closest point to the sun in October, Hidalgo will appear to pass almost exactly in front of a 10th-magnitude star, blocking its light out for up to 5 seconds in a phenomenon called an occultation. By observing it and measuring how long the light remains blocked out for, we can construct the apparent shape of the asteroid to a much higher accuracy than any other method can give us except just flying a spacecraft over.

It's currently thought that Hidalgo might be a contact binary, like the recently explored 2014 MU69/Ultima thule, but that can't be confirmed until we can tell what its shape is, something that the 2019/02/16 occultation could tell us if we get enough observers.

&amp;#x200B;

Due to the asteroid's fairly small size (about 50-60 kilometers), the 'shadow' it will cast from the star is only 50-60 kilometers across, and extends over a small area of Vancouver island, northern Washington, northern Idaho, southern Montana, and Wyoming, before its shadow passes over the eastern US, where dawn will already be starting. Is anyone in that area available to get up around 5:30 AM on February 16 to help us learn more about the nature of the asteroid Hidalgo?","Need anyone with a &gt;5 inch telescope from Washington/northern Idaho/Wyoming for an occultation on 2019/02/16, no experience required! Hey everyone, after the (somewhat successful) observation of the asteroid 2015 TG387 on October 20, I would like to once again ask publically if anyone is interested and available to observe a new object: the unusual asteroid 944 Hidalgo. Just to give some background, it's a very strange asteroid whose orbit takes it from just inside the asteroid belt to almost the orbit of Saturn. It has a strangely comet-like orbit, and scientists think that it used to be a comet at some point that already lost all of its ice and dust.

In the early morning of February 16, just after it reached its closest point to the sun in October, Hidalgo will appear to pass almost exactly in front of a 10th-magnitude star, blocking its light out for up to 5 seconds in a phenomenon called an occultation. By observing it and measuring how long the light remains blocked out for, we can construct the apparent shape of the asteroid to a much higher accuracy than any other method can give us except just flying a spacecraft over.

It's currently thought that Hidalgo might be a contact binary, like the recently explored 2014 MU69/Ultima thule, but that can't be confirmed until we can tell what its shape is, something that the 2019/02/16 occultation could tell us if we get enough observers.

&amp;#x200B;

Due to the asteroid's fairly small size (about 50-60 kilometers), the 'shadow' it will cast from the star is only 50-60 kilometers across, and extends over a small area of Vancouver island, northern Washington, northern Idaho, southern Montana, and Wyoming, before its shadow passes over the eastern US, where dawn will already be starting. Is anyone in that area available to get up around 5:30 AM on February 16 to help us learn more about the nature of the asteroid Hidalgo?"
Centaurus A,,Centaurus A 
Ancient Astronomy. Interesting Stories and Facts?,"Okay. I'm trying to write a book on Astronomy, and how it has evolved over the years. And I've got some solid content on the Middle section, (with Galileo, Copernicus, Tycho Brahe, Johannes Kepler, etc) and Modern Astronomy, with Relativity, Stephen Hawking and his work on Black Holes, and Carl Sagan.

I'm struck with what to write in the Early Astronomy section. I know it was mostly studying constellations, and geocentric theories by a lot of Greek, Arab, and Indian philosophers.  Some philosophers came up with early evidence of Spherical Earth and Heliocentrisim. But what I'm struck with, is that I'm not able to find any particularly interesting stories to being with.

Are there any interesting stories with any person coming up with constellations, or studying them? 

I'm not finding any good event or story like that to start off the book. 

I need to do research if I have to get somewhere with the book, and I'm willing to do that.  Can anyone give some pointers on where to research?

Thanks guys.

","Ancient Astronomy. Interesting Stories and Facts? Okay. I'm trying to write a book on Astronomy, and how it has evolved over the years. And I've got some solid content on the Middle section, (with Galileo, Copernicus, Tycho Brahe, Johannes Kepler, etc) and Modern Astronomy, with Relativity, Stephen Hawking and his work on Black Holes, and Carl Sagan.

I'm struck with what to write in the Early Astronomy section. I know it was mostly studying constellations, and geocentric theories by a lot of Greek, Arab, and Indian philosophers.  Some philosophers came up with early evidence of Spherical Earth and Heliocentrisim. But what I'm struck with, is that I'm not able to find any particularly interesting stories to being with.

Are there any interesting stories with any person coming up with constellations, or studying them? 

I'm not finding any good event or story like that to start off the book. 

I need to do research if I have to get somewhere with the book, and I'm willing to do that.  Can anyone give some pointers on where to research?

Thanks guys.

"
"The first color image of Ultima Thule, taken at a distance of 137,000 km at 4:08 UT on January 1, 2019 [2412x958] [OS]",,"The first color image of Ultima Thule, taken at a distance of 137,000 km at 4:08 UT on January 1, 2019 [2412x958] [OS] "
Why there are only 5 dwarf planets in solar system?,"Hello,

&amp;#x200B;

I wanted to ask, why only 5 dwarf planets are considered to be ""solar system dwarf planets"" (according to NASA [https://solarsystem.nasa.gov/](https://solarsystem.nasa.gov/)), while there are others discovered lately? People keeps counting 8 Planets + 5 Dwarf Planets in solar system, which is confusing to me, because such objects as Eris or Farout orbits Sun and meets requirements for ""dwarf planet"" definition. Are they too far to be considered?

&amp;#x200B;

EDIT:

&amp;#x200B;

Thanks for answers guys, now I understand :) 

&amp;#x200B;","Why there are only 5 dwarf planets in solar system? Hello,

&amp;#x200B;

I wanted to ask, why only 5 dwarf planets are considered to be ""solar system dwarf planets"" (according to NASA [https://solarsystem.nasa.gov/](https://solarsystem.nasa.gov/)), while there are others discovered lately? People keeps counting 8 Planets + 5 Dwarf Planets in solar system, which is confusing to me, because such objects as Eris or Farout orbits Sun and meets requirements for ""dwarf planet"" definition. Are they too far to be considered?

&amp;#x200B;

EDIT:

&amp;#x200B;

Thanks for answers guys, now I understand :) 

&amp;#x200B;"
Lunar eclipse on 1/21/19!,"Find out the details of if you can see it here:

https://www.timeanddate.com/eclipse/lunar/2019-january-21

A majority of the world will be able to see at least a partial eclipse, with all of North and South America being able to witness totality. Last night I randomly asked Alexa when the next eclipse was in my area, and I thought she was in joke mode, but nope. Just a couple weeks away!  Great way to test out those new Christmas telescopes. ","Lunar eclipse on 1/21/19! Find out the details of if you can see it here:

https://www.timeanddate.com/eclipse/lunar/2019-january-21

A majority of the world will be able to see at least a partial eclipse, with all of North and South America being able to witness totality. Last night I randomly asked Alexa when the next eclipse was in my area, and I thought she was in joke mode, but nope. Just a couple weeks away!  Great way to test out those new Christmas telescopes. "
The Owl Cluster,,The Owl Cluster 
"New Horizons successfully ""phoned home"" this morning, letting scientists know its sytems survived the flyby of Ultima Thule, a small, icy body located some 4 billion miles (6.6 billion km) from Earth.",,"New Horizons successfully ""phoned home"" this morning, letting scientists know its sytems survived the flyby of Ultima Thule, a small, icy body located some 4 billion miles (6.6 billion km) from Earth. "
Messier 36 - Open Cluster in Auriga,,Messier 36 - Open Cluster in Auriga 
"A 29-cent Pluto stamp designed in 1991 that read ""Not yet explored"" served as a call-to-arms, rallying support for the New Horizons Pluto mission. In less than 12 hours, New Horizons will flyby the most distant object ever explored by a spacecraft, Ultima Thule, located some 4 billion miles away.",,"A 29-cent Pluto stamp designed in 1991 that read ""Not yet explored"" served as a call-to-arms, rallying support for the New Horizons Pluto mission. In less than 12 hours, New Horizons will flyby the most distant object ever explored by a spacecraft, Ultima Thule, located some 4 billion miles away. "
Remembering Riccardo Giacconi: A Titan of the Heroic Age of Astronomy,,Remembering Riccardo Giacconi: A Titan of the Heroic Age of Astronomy 
The Hidden Galaxy,,The Hidden Galaxy 
Holiday Asteroid Imaged with NASA Radar,,Holiday Asteroid Imaged with NASA Radar 
Saturn's rings are halfway to their death,,Saturn's rings are halfway to their death 
See brightest star Sirius at midnight on New Year's Eve,,See brightest star Sirius at midnight on New Year's Eve 
This Morning's 46% Waning Crescent Moon in Monochrome [OC],,This Morning's 46% Waning Crescent Moon in Monochrome [OC] 
Taking an astronomy college course?,I just saw the local college offers both in person and online astronomy courses (the prereq for the class after where you go and do stuff at night etc.) I’m just kinda curious how many of you have taken a similar course? What were your thoughts and experiences? I just want to expand my knowledge and get better at observing space!,Taking an astronomy college course? I just saw the local college offers both in person and online astronomy courses (the prereq for the class after where you go and do stuff at night etc.) I’m just kinda curious how many of you have taken a similar course? What were your thoughts and experiences? I just want to expand my knowledge and get better at observing space!
New Horizons set for humanity’s first ever Kuiper Belt rendezvous,,New Horizons set for humanity’s first ever Kuiper Belt rendezvous 
I have a friend working at the South Pole Telescope (SPT) right now. They took a break to build an igloo over the holidays! SPT in the background,,I have a friend working at the South Pole Telescope (SPT) right now. They took a break to build an igloo over the holidays! SPT in the background 
"Nancy Grace Roman, NASA's first chief astronomer celebrated as ‘mother’ of Hubble, dies at 93",,"Nancy Grace Roman, NASA's first chief astronomer celebrated as ‘mother’ of Hubble, dies at 93 "
A thank you.,"Hello people of r/Astronomy! Over two months ago I came to you seeking advice on a Powerseeker 114AZ that was gifted to me by a person who no longer wanted it. (Pretty easy to see why now lmao) Anyways, you folks didn’t throw me to the wolves and even taught me some very important things that ended having me hooked on Stargazing. Got an Orion XT8 for Christmas this year along with an eyepiece kit and some red flashlights. Tonight was the first night I was able to observe without cloud interference.
My little brother and I went out to my Bortle 6 backyard and saw Andromeda, the Orion Nebula, and the Pleiades in all their glory. I was already hooked on astronomy but I think my little brother is a little jealous of the XT8 now! So thank you for being a kind community and answering my questions with valued responses! 
 
Now if you’ll excuse me, this Owl Cluster is going to be seen. It can be 22 degrees all it wants!","A thank you. Hello people of r/Astronomy! Over two months ago I came to you seeking advice on a Powerseeker 114AZ that was gifted to me by a person who no longer wanted it. (Pretty easy to see why now lmao) Anyways, you folks didn’t throw me to the wolves and even taught me some very important things that ended having me hooked on Stargazing. Got an Orion XT8 for Christmas this year along with an eyepiece kit and some red flashlights. Tonight was the first night I was able to observe without cloud interference.
My little brother and I went out to my Bortle 6 backyard and saw Andromeda, the Orion Nebula, and the Pleiades in all their glory. I was already hooked on astronomy but I think my little brother is a little jealous of the XT8 now! So thank you for being a kind community and answering my questions with valued responses! 
 
Now if you’ll excuse me, this Owl Cluster is going to be seen. It can be 22 degrees all it wants!"
Venus in Daylight,,Venus in Daylight 
Milky Way and Earth's rotation,,Milky Way and Earth's rotation 
AAS Winter Meeting Affected by U.S. Government Shutdown,,AAS Winter Meeting Affected by U.S. Government Shutdown 
[QUESTION] Are there any resources to show the apparent retrograde paths by year?,"The loops tend to vary each time, so I'd love to find the paths for each planet for a given year. Thanks in advance for any help.","[QUESTION] Are there any resources to show the apparent retrograde paths by year? The loops tend to vary each time, so I'd love to find the paths for each planet for a given year. Thanks in advance for any help."
