title,selftext,post
Failed attempt at the Leo triplets [OC],,Failed attempt at the Leo triplets [OC] 
"M106, NGC 4217, NGC 4248, and more",,"M106, NGC 4217, NGC 4248, and more "
Sharpless Nebulae 232 and 235,,Sharpless Nebulae 232 and 235 
EHT will release Humanity's first glimpse of a black hole's event horizon in a press conference on April 10th!,,EHT will release Humanity's first glimpse of a black hole's event horizon in a press conference on April 10th! 
M42/My first Image... I just got a new telescope and took it to a dark sky park to test it out... this is my first image I’ve taken so feedback is welcome.,,M42/My first Image... I just got a new telescope and took it to a dark sky park to test it out... this is my first image I’ve taken so feedback is welcome. 
"Got this tat of Orion with my bro, What do you guys think?",,"Got this tat of Orion with my bro, What do you guys think? "
"Not strictly astronomy, but also human. I finally have a buddy for evening observations: my own daughter (7F). We had our first observation session, and although most newbies are underwhelmed their first time, she looked at M42 with me and said, ""Is that really a space cloud with stars in it? Wow!""",,"Not strictly astronomy, but also human. I finally have a buddy for evening observations: my own daughter (7F). We had our first observation session, and although most newbies are underwhelmed their first time, she looked at M42 with me and said, ""Is that really a space cloud with stars in it? Wow!"" "
How much of a difference does 0.7 mag/arcsec^2 make?,"I've had my telescope for about a year and a half now, and I am happy with it. I've only really used it in my backyard just outside of a city of \~25k people and according to [lightpollutionmap.info](https://lightpollutionmap.info) my sky should be about 20.04 mag./arcsec\^2. I can take a short-ish drive to a park where it says the sky there would be about 20.70 mag./arcsec\^2.

&amp;#x200B;

My question is how much of a noticeable difference will that 0.7 make?","How much of a difference does 0.7 mag/arcsec^2 make? I've had my telescope for about a year and a half now, and I am happy with it. I've only really used it in my backyard just outside of a city of \~25k people and according to [lightpollutionmap.info](https://lightpollutionmap.info) my sky should be about 20.04 mag./arcsec\^2. I can take a short-ish drive to a park where it says the sky there would be about 20.70 mag./arcsec\^2.

&amp;#x200B;

My question is how much of a noticeable difference will that 0.7 make?"
How Universe expanded beyond the visible BUT not faster than the speed of light?, Seems that the Universe has 46 billion light years in diameter and yet only 14 billion years old! How can this be possible at the speed of light? ,How Universe expanded beyond the visible BUT not faster than the speed of light?  Seems that the Universe has 46 billion light years in diameter and yet only 14 billion years old! How can this be possible at the speed of light? 
How do you guys confirm you’ve seen something?,"I have an 8” Dob and live under Bortle 6 skies. I’ve tried about 3 months on and off to catch a glimpse of Bode’s galaxy and the Cigar and FINALLLYYYY... over this weekend I think I saw Bode’s. I saw an elliptical blob right where it should’ve been... and saw a peculiar looking “L”-asterism of stars that I ended up finding on pictures online as well. I didn’t see the Cigar but I realized I looked at the wrong spot. Anyway... how do you guys verify you’ve seen something? 

As a side question... what other targets should I go for next? The Pinwheel and Whirlpool are in the same constellation, but I’ve heard they were much fainter. Thanks dudes! 

","How do you guys confirm you’ve seen something? I have an 8” Dob and live under Bortle 6 skies. I’ve tried about 3 months on and off to catch a glimpse of Bode’s galaxy and the Cigar and FINALLLYYYY... over this weekend I think I saw Bode’s. I saw an elliptical blob right where it should’ve been... and saw a peculiar looking “L”-asterism of stars that I ended up finding on pictures online as well. I didn’t see the Cigar but I realized I looked at the wrong spot. Anyway... how do you guys verify you’ve seen something? 

As a side question... what other targets should I go for next? The Pinwheel and Whirlpool are in the same constellation, but I’ve heard they were much fainter. Thanks dudes! 

"
My local school just built an observatory for K-12 use. The first program of its kind in the nation!,,My local school just built an observatory for K-12 use. The first program of its kind in the nation! 
Some may find this intesting.,,Some may find this intesting. 
M52 and NGC7635 (Bubble nebula),,M52 and NGC7635 (Bubble nebula) 
M51 (Whirlpool galaxy) First time processing and taking a photo of a deep-sky object,,M51 (Whirlpool galaxy) First time processing and taking a photo of a deep-sky object 
Messier 96 - A Spiral Galaxy in Leo,,Messier 96 - A Spiral Galaxy in Leo 
What are some interesting astronomy hoaxes or misconceptions?,"So I’m planning an astronomy club meeting for April 1st and I thought it would be fitting to do a “prank” themed club meeting. 

I wanted to share discoveries that we thought to be true then later disproved (i.e. the Little Green Men Signal or Tabby’s star). 

I also wanted to get a bit weirder with it and talk about UFO sightings and hoaxes that were easily disproven or ones that were more difficult to explain. 

I know it’s kind of a weird topic but I wanted to do something different for our club members. I would love to hear some of your favorite “It’s aliens! Wait.. it’s just dust” astronomy moments or anything similar! Thank you! ","What are some interesting astronomy hoaxes or misconceptions? So I’m planning an astronomy club meeting for April 1st and I thought it would be fitting to do a “prank” themed club meeting. 

I wanted to share discoveries that we thought to be true then later disproved (i.e. the Little Green Men Signal or Tabby’s star). 

I also wanted to get a bit weirder with it and talk about UFO sightings and hoaxes that were easily disproven or ones that were more difficult to explain. 

I know it’s kind of a weird topic but I wanted to do something different for our club members. I would love to hear some of your favorite “It’s aliens! Wait.. it’s just dust” astronomy moments or anything similar! Thank you! "
Kuiper Belt Objects Are as Mysterious as They Are Distant,,Kuiper Belt Objects Are as Mysterious as They Are Distant 
ISS shot on Smartphone,,ISS shot on Smartphone 
sunrise/set azimuth moves a lot more day-to-day that you might realize,,sunrise/set azimuth moves a lot more day-to-day that you might realize 
First run of ABRACADABRA experiment finds no evidence of 'ghost-like' axion particles,,First run of ABRACADABRA experiment finds no evidence of 'ghost-like' axion particles 
"Direct imaging of four super-Jupiters in the HR 8799 system, 129 ly away",,"Direct imaging of four super-Jupiters in the HR 8799 system, 129 ly away "
NGC 1333 - A star forming region in Perseus,,NGC 1333 - A star forming region in Perseus 
"How does the Milky way galaxy look like without any telescope/editing or anything, just the naked eye?","I dont quite believe [that](https://i.imgur.com/IKEjwBc.jpg) &lt;--- (IMGUR LINK) is how it looks like to just the naked eye, is there any images to shows almost exactly how it looks like to a person in a dark enough place to see it?

&amp;#x200B;

I myself like astronomy, but i live in the city and cant see more than (at most) 20 stars at night, its kinda boring :(","How does the Milky way galaxy look like without any telescope/editing or anything, just the naked eye? I dont quite believe [that](https://i.imgur.com/IKEjwBc.jpg) &lt;--- (IMGUR LINK) is how it looks like to just the naked eye, is there any images to shows almost exactly how it looks like to a person in a dark enough place to see it?

&amp;#x200B;

I myself like astronomy, but i live in the city and cant see more than (at most) 20 stars at night, its kinda boring :("
Question about early education for a child,"So, my son has, thankfully, inherited mine and my father’s curiosity for all things space. He is six years old, and has been fascinated since about 3 years old. He is non-verbal, but has absolutely no learning delay(I know it might sound silly, but he’s the smartest child in his kindergarten class haha). He pointed out Orion, the Big and Little Dippers, and the North Star, and I know for a fact myself not his father taught him that. 

Anyway, enough with me boasting about my child, and on to the question. 

I would like to get him involved in classes where he can learn about space at a pace appropriate for his age. I live in a smaller city in northwest Ohio, and I’m not sure where to look. I am close to the Armstrong Space Museum, but it’s not as educational as I’d like. 

Thanks!","Question about early education for a child So, my son has, thankfully, inherited mine and my father’s curiosity for all things space. He is six years old, and has been fascinated since about 3 years old. He is non-verbal, but has absolutely no learning delay(I know it might sound silly, but he’s the smartest child in his kindergarten class haha). He pointed out Orion, the Big and Little Dippers, and the North Star, and I know for a fact myself not his father taught him that. 

Anyway, enough with me boasting about my child, and on to the question. 

I would like to get him involved in classes where he can learn about space at a pace appropriate for his age. I live in a smaller city in northwest Ohio, and I’m not sure where to look. I am close to the Armstrong Space Museum, but it’s not as educational as I’d like. 

Thanks!"
How do you spot AD Leonis in the night sky?,"It's my friend's birthday today, and it's his sixteenth birthday. I looked around in a few star databases, and AD Leonis (Gliese 388) is almost exactly 16 light years away.

I want to call him and tell him to look for the Leo Constellation and from there look for this star, and tell that the light he's seeing from the star is just as old as him, kinda like an extra Birthday present.

I'm unable to find any photos online of where it is located relative to the rest of the constellation, for visualising. Can anyone help with how to spot this star?

He's good at spotting constellations, so don't worry about that.

Thanks.

","How do you spot AD Leonis in the night sky? It's my friend's birthday today, and it's his sixteenth birthday. I looked around in a few star databases, and AD Leonis (Gliese 388) is almost exactly 16 light years away.

I want to call him and tell him to look for the Leo Constellation and from there look for this star, and tell that the light he's seeing from the star is just as old as him, kinda like an extra Birthday present.

I'm unable to find any photos online of where it is located relative to the rest of the constellation, for visualising. Can anyone help with how to spot this star?

He's good at spotting constellations, so don't worry about that.

Thanks.

"
Question on the expansion of the universe,"I saw the NEil Degrasse Tyson narrated “Dark Universe” the other day and had a question. I recall him stating that not only is the universe expanding, but it is accelerating, depending on where you are in the universe, everything appears to be expanding away from you. How is this possible?  If I am in galaxy 1, and there is a galaxy 2 between me and galaxy 3, both galaxy 2 and 3 would be moving away from me, and 2 wpuld be moving towards 3. But if I’m in galaxy 3, galaxy 2 would also be moving away from me and towards galaxy 1. How is this possible?","Question on the expansion of the universe I saw the NEil Degrasse Tyson narrated “Dark Universe” the other day and had a question. I recall him stating that not only is the universe expanding, but it is accelerating, depending on where you are in the universe, everything appears to be expanding away from you. How is this possible?  If I am in galaxy 1, and there is a galaxy 2 between me and galaxy 3, both galaxy 2 and 3 would be moving away from me, and 2 wpuld be moving towards 3. But if I’m in galaxy 3, galaxy 2 would also be moving away from me and towards galaxy 1. How is this possible?"
Messier 81 – Bode’s Galaxy in Ursa Major,,Messier 81 – Bode’s Galaxy in Ursa Major 
"Free educational materials (HD videos, images, infographics, planetarium stuff, etc.) from the European Southern Observatory. Not only for planetariums.",,"Free educational materials (HD videos, images, infographics, planetarium stuff, etc.) from the European Southern Observatory. Not only for planetariums. "
Hubble Watches Spun-up Asteroid Coming Apart,,Hubble Watches Spun-up Asteroid Coming Apart 
Where can I find historical solar magnetic activity graphs for specific countries?,"Would like to link some aurora borealis pictures to logged solar activity, so that I get a closer idea of how many X look like Y northern light picture.

Thank you!","Where can I find historical solar magnetic activity graphs for specific countries? Would like to link some aurora borealis pictures to logged solar activity, so that I get a closer idea of how many X look like Y northern light picture.

Thank you!"
What would Hubble images really look like if you were floating around in space?,"I have been googling this now for a while, and the only responses I can seem to find are describing how the Hubble telescope interprets and represents colour input using a RGB colour scheme. A regular telescope eyepiece from Earth would not detect these colours.

&amp;#x200B;

However, what I really want to know, is what would you see if you were floating in space right next to a galaxy in a Hubble photograph? I'm not concerned with what you would see from Earth, but what I would see from deep space with the naked eye.

&amp;#x200B;

For example: [https://cdn.spacetelescope.org/archives/images/publicationjpg/opo0328a.jpg](https://cdn.spacetelescope.org/archives/images/publicationjpg/opo0328a.jpg)

&amp;#x200B;

What if I were floating in a space suit next to this galaxy? What would it look like to the naked eye? ","What would Hubble images really look like if you were floating around in space? I have been googling this now for a while, and the only responses I can seem to find are describing how the Hubble telescope interprets and represents colour input using a RGB colour scheme. A regular telescope eyepiece from Earth would not detect these colours.

&amp;#x200B;

However, what I really want to know, is what would you see if you were floating in space right next to a galaxy in a Hubble photograph? I'm not concerned with what you would see from Earth, but what I would see from deep space with the naked eye.

&amp;#x200B;

For example: [https://cdn.spacetelescope.org/archives/images/publicationjpg/opo0328a.jpg](https://cdn.spacetelescope.org/archives/images/publicationjpg/opo0328a.jpg)

&amp;#x200B;

What if I were floating in a space suit next to this galaxy? What would it look like to the naked eye? "
GRAVITY instrument breaks new ground in exoplanet imaging - Reveals details of a storm-wracked exoplanet using optical interferometry,,GRAVITY instrument breaks new ground in exoplanet imaging - Reveals details of a storm-wracked exoplanet using optical interferometry 
SAOImageDS9 Help?,"Hi, so I’m a student in college currently trying to figure out how to use the given program in the title which is commonly used in astronomy for educational purposes, and I was wondering if anyone else was having trouble using shapes in the program, or better yet, if there was a solution to the problem. It’s needed for a lab that I’m doing where I need to be able to use the Line function in order to measure the diameter of a given nebula and then use that diameter and other factors to find the volume of said nebula. I’m able to open everything up to the Line function (Region -&gt; Shape -&gt; Line), but when I click Line, though it’s indicated that it’s selected, it doesn’t perform the function when I click and drag as it’s supposed to. It’s not the variation of the program itself, as I have now downloaded it onto a Mac and even a library desktop to no avail. To make matters worse, all of the FAQs and help guides on the program are of no help, either just saying to do what I have already done or referencing the Command Line whenever I use the word “Line” in my individual searches. I hope that someone on this sub is able to help, though it’s an obscure problem on a probably not-very popular program. Nonetheless, any help is much appreciated!","SAOImageDS9 Help? Hi, so I’m a student in college currently trying to figure out how to use the given program in the title which is commonly used in astronomy for educational purposes, and I was wondering if anyone else was having trouble using shapes in the program, or better yet, if there was a solution to the problem. It’s needed for a lab that I’m doing where I need to be able to use the Line function in order to measure the diameter of a given nebula and then use that diameter and other factors to find the volume of said nebula. I’m able to open everything up to the Line function (Region -&gt; Shape -&gt; Line), but when I click Line, though it’s indicated that it’s selected, it doesn’t perform the function when I click and drag as it’s supposed to. It’s not the variation of the program itself, as I have now downloaded it onto a Mac and even a library desktop to no avail. To make matters worse, all of the FAQs and help guides on the program are of no help, either just saying to do what I have already done or referencing the Command Line whenever I use the word “Line” in my individual searches. I hope that someone on this sub is able to help, though it’s an obscure problem on a probably not-very popular program. Nonetheless, any help is much appreciated!"
Orion widefield,,Orion widefield 
M101 - The Pinwheel Galaxy - 15hrs,,M101 - The Pinwheel Galaxy - 15hrs 
What are some books on the very end of the universe?,,What are some books on the very end of the universe? 
"Schiller Crater - March 17, 2019",,"Schiller Crater - March 17, 2019 "
When Sky &amp; Telescope Magazine Had No Limit,,When Sky &amp; Telescope Magazine Had No Limit 
How Can We Still See The Disappearing Universe?,,How Can We Still See The Disappearing Universe? 
Any observers in the Washington State area? Looking for a place to see the Milky Way/best views of the stars.,"Planning a trip to Seattle in Sept. Want to spend a day hiking, then stargazing. Just isolating myself in wilderness. I would crash wherever I am, then return to the city the next day. 

I have read about Artist Point and the peninsula....but if you had to choose one?

Really appreciate the help.","Any observers in the Washington State area? Looking for a place to see the Milky Way/best views of the stars. Planning a trip to Seattle in Sept. Want to spend a day hiking, then stargazing. Just isolating myself in wilderness. I would crash wherever I am, then return to the city the next day. 

I have read about Artist Point and the peninsula....but if you had to choose one?

Really appreciate the help."
Request for Sources on Stellar Nucleosynthesis,"Hi all. 

&amp;#x200B;

I'm in an introductory astronomy class and writing a term paper on stellar nucleosynthesis. This is a lofty subject for an intro class, but my professor urged the class to choose a topic that interested us rather than a topic that we thought he would like. 

&amp;#x200B;

I understand the basics; that under extreme heat and pressure elemental composition of atoms is changed. In early stars this was Hydrogen to Helium, and in later stellar generations, more massive elements were formed, up until Iron. I'm focusing the paper on why Iron is the most massive element that can be synthesized within a stellar core, and then briefly on how the heavier elements are formed (supernovae). 

&amp;#x200B;

Given how far over my head the topic is, I'm struggling to find sources that I can understand and utilize. Any suggestions would be greatly appreciated!","Request for Sources on Stellar Nucleosynthesis Hi all. 

&amp;#x200B;

I'm in an introductory astronomy class and writing a term paper on stellar nucleosynthesis. This is a lofty subject for an intro class, but my professor urged the class to choose a topic that interested us rather than a topic that we thought he would like. 

&amp;#x200B;

I understand the basics; that under extreme heat and pressure elemental composition of atoms is changed. In early stars this was Hydrogen to Helium, and in later stellar generations, more massive elements were formed, up until Iron. I'm focusing the paper on why Iron is the most massive element that can be synthesized within a stellar core, and then briefly on how the heavier elements are formed (supernovae). 

&amp;#x200B;

Given how far over my head the topic is, I'm struggling to find sources that I can understand and utilize. Any suggestions would be greatly appreciated!"
"SAOimage ds9 ignoring co-ord data when exporting RGB frames, giving misaligned images","This is kinda a software issue but i couldn't think of a better place to ask with how little time i have to fix this.  I have a university assignment that involved using ds9 to analyse images of the Southern Pinwheel Galaxy.  When we first got our hands on the data, the H-alpha data was missing co-ord data and was a little off, so we had to put that in ourselves.  WE

e did  that, and now all of the frames line up in the programs viewer.

&amp;#x200B;

&amp;#x200B;

[Image 1: The image from within the ds9 viewer.  Notice that the blue frame is slightly up and to the right](https://i.redd.it/fbkcbpwbepo21.png)

&amp;#x200B;

However, when exporting as any type of image, the program ignores the co-ord data and just lines the images up one on top of the other.

&amp;#x200B;

&amp;#x200B;

[Image 2: What ds9 in exporting.  Notice how it is stupid and hideous and will give me a fail in this assignment](https://i.redd.it/t9y3lzpsepo21.png)

&amp;#x200B;

Pleas help me, i am running out of time.

&amp;#x200B;

edit: As one might have assumed would happen, i figured out the problem a solid 15 seconds after making this post.  The problem was caused in part by the fact that i was meant to be printing the image to a file (which works), instead of saving or exporting it.  Don't exactly know why saving or exporting doesn't work but there you go.  ","SAOimage ds9 ignoring co-ord data when exporting RGB frames, giving misaligned images This is kinda a software issue but i couldn't think of a better place to ask with how little time i have to fix this.  I have a university assignment that involved using ds9 to analyse images of the Southern Pinwheel Galaxy.  When we first got our hands on the data, the H-alpha data was missing co-ord data and was a little off, so we had to put that in ourselves.  WE

e did  that, and now all of the frames line up in the programs viewer.

&amp;#x200B;

&amp;#x200B;

[Image 1: The image from within the ds9 viewer.  Notice that the blue frame is slightly up and to the right](https://i.redd.it/fbkcbpwbepo21.png)

&amp;#x200B;

However, when exporting as any type of image, the program ignores the co-ord data and just lines the images up one on top of the other.

&amp;#x200B;

&amp;#x200B;

[Image 2: What ds9 in exporting.  Notice how it is stupid and hideous and will give me a fail in this assignment](https://i.redd.it/t9y3lzpsepo21.png)

&amp;#x200B;

Pleas help me, i am running out of time.

&amp;#x200B;

edit: As one might have assumed would happen, i figured out the problem a solid 15 seconds after making this post.  The problem was caused in part by the fact that i was meant to be printing the image to a file (which works), instead of saving or exporting it.  Don't exactly know why saving or exporting doesn't work but there you go.  "
Tips for capturing M51?,"Tomorrow I will attempt to capture a galaxy, M51 has been suggested to me so I want to do that  


However, since its my first time i'm a bit lost. I never took a photo of any other galaxy (not even Andromeda) and I only took a picture of the orion nebula, and that was without a T-ring (now i have one)  


So, what is the best way to approach this galaxy? I have a canon 550d/T2i, Skywatcher 130/600 scope. Skywatcher HEQ5 mount and thats about it. (Before you say to try to attempt a closer object, I want to aim big and to see what I can achieve right now)","Tips for capturing M51? Tomorrow I will attempt to capture a galaxy, M51 has been suggested to me so I want to do that  


However, since its my first time i'm a bit lost. I never took a photo of any other galaxy (not even Andromeda) and I only took a picture of the orion nebula, and that was without a T-ring (now i have one)  


So, what is the best way to approach this galaxy? I have a canon 550d/T2i, Skywatcher 130/600 scope. Skywatcher HEQ5 mount and thats about it. (Before you say to try to attempt a closer object, I want to aim big and to see what I can achieve right now)"
