title,selftext,post
Jupiter's atmosphere evolution of 1 year through amatorial telescopes,"To  understand the **atmosphere evolution** of Jupiter we need to analyze very long time lapse, so we can see that the major structure are moving each other in different direction and transforming . The mere fact that the planet rotates in 10 hours , and that there are no points of reference can be deceiving  and only comparing two pictures taken in different months, we realize  that something has changed. Add also the weather and day/night variables and get it clear in reality is not so easy.I love transiet events, so I decided several years ago to make that evident but with data that also an amatorial telescope can collect and not with a computer simulation or cassini images.

To follow  this movement we need a point to use as reference on this **gas surface**  where everything move and change. The Great Red Spot was perfect for  this purpose, everyone know it and is just big enought.

I spent several days of  2013 on this project but the work was huge and I spent a lot of time collecting enought data to fill all the temporal holes and I gradually completed. I contacted several  imagers like me to have enought data because I needed jupiter at all  the hours of the day, even with the sun at my  longitude.

When I had enought to start I  selected and divided all the captures in range of 3 days and using photoshop I nornalized the contrast,  gamma, color correction and resolution of each one to make them more uniform. I tryed to have 4-6 pictures for each map I wanted to build, images produced by amatorial instruments.I  collected images of Jupiters in different hours of the day to cover all  the rotation of the planet, then I used WinJupos  to link the time/space coordinate to the captured files so that the software knows when and where of each pixels. Then I build a unique rectangular map using few pixel for each original capture,  making verification that the data I received was correct (not always).

When I finished all the cylindrical map I fixed my meridian of reference on the  **Great Red Spot**, aligned all the stack images and built an animation on **Photoshop/WinJupos**.

After several  weeks I finally reached the final timelapse, it was 6 years ago but I think is still of some value.

But you must not stop only to that, images are made of data that can be studied. Always with WinJupos (a great software) you can analyze the movements of all the structures that are evident, measure their velocity and see that the ovals passing next the GRS change their velocity slowing down or accelerating  coming into contact with the turbulence caused by the red spot.   We can also derive the actual dimensions of the different formations.

Thinking that today you can achieve with a little 'commitment from the courtyard of your home amateur analysis of this kind should ignite curiosity in every amateur.

&amp;#x200B;

The video is hosted on Youtube, let me know if I can post it.

https://i.redd.it/smdbzmew0eh21.png

Here the list of the original owners of the pixels scattered in different mosaics in alphabetical order:

A.Bianconi  - A.Coffelt - C.Go - C.Pellier - D.Parker - D.Peach - E.Morales -  E.Pottillius - F.Volpe - F.Willems - G.Jolly - G.Tarsoudis - G. Walker -  H.Einaga - J.Poupeau - L.Aerts - M.Kardasis - P.Edwars - R.Iwamasa -  T.Hansen - T.Horiuchi - T.Yoshida - W.Jaeschke - ZuoZhao","Jupiter's atmosphere evolution of 1 year through amatorial telescopes To  understand the **atmosphere evolution** of Jupiter we need to analyze very long time lapse, so we can see that the major structure are moving each other in different direction and transforming . The mere fact that the planet rotates in 10 hours , and that there are no points of reference can be deceiving  and only comparing two pictures taken in different months, we realize  that something has changed. Add also the weather and day/night variables and get it clear in reality is not so easy.I love transiet events, so I decided several years ago to make that evident but with data that also an amatorial telescope can collect and not with a computer simulation or cassini images.

To follow  this movement we need a point to use as reference on this **gas surface**  where everything move and change. The Great Red Spot was perfect for  this purpose, everyone know it and is just big enought.

I spent several days of  2013 on this project but the work was huge and I spent a lot of time collecting enought data to fill all the temporal holes and I gradually completed. I contacted several  imagers like me to have enought data because I needed jupiter at all  the hours of the day, even with the sun at my  longitude.

When I had enought to start I  selected and divided all the captures in range of 3 days and using photoshop I nornalized the contrast,  gamma, color correction and resolution of each one to make them more uniform. I tryed to have 4-6 pictures for each map I wanted to build, images produced by amatorial instruments.I  collected images of Jupiters in different hours of the day to cover all  the rotation of the planet, then I used WinJupos  to link the time/space coordinate to the captured files so that the software knows when and where of each pixels. Then I build a unique rectangular map using few pixel for each original capture,  making verification that the data I received was correct (not always).

When I finished all the cylindrical map I fixed my meridian of reference on the  **Great Red Spot**, aligned all the stack images and built an animation on **Photoshop/WinJupos**.

After several  weeks I finally reached the final timelapse, it was 6 years ago but I think is still of some value.

But you must not stop only to that, images are made of data that can be studied. Always with WinJupos (a great software) you can analyze the movements of all the structures that are evident, measure their velocity and see that the ovals passing next the GRS change their velocity slowing down or accelerating  coming into contact with the turbulence caused by the red spot.   We can also derive the actual dimensions of the different formations.

Thinking that today you can achieve with a little 'commitment from the courtyard of your home amateur analysis of this kind should ignite curiosity in every amateur.

&amp;#x200B;

The video is hosted on Youtube, let me know if I can post it.

https://i.redd.it/smdbzmew0eh21.png

Here the list of the original owners of the pixels scattered in different mosaics in alphabetical order:

A.Bianconi  - A.Coffelt - C.Go - C.Pellier - D.Parker - D.Peach - E.Morales -  E.Pottillius - F.Volpe - F.Willems - G.Jolly - G.Tarsoudis - G. Walker -  H.Einaga - J.Poupeau - L.Aerts - M.Kardasis - P.Edwars - R.Iwamasa -  T.Hansen - T.Horiuchi - T.Yoshida - W.Jaeschke - ZuoZhao"
My discovery of possible dwarf nova on the digitized photographic plates,,My discovery of possible dwarf nova on the digitized photographic plates 
Bright Opportunities for Atmospheric Characterization of Small Planets,,Bright Opportunities for Atmospheric Characterization of Small Planets 
SMC FITS File?,"Hi everyone, 
I’m currently doing a research project on supernovae in the Small Magellanic  Cloud. I’m trying to find a FITS image of the whole SMC, to then plot the SNe locations on (I’ve already got the code - I used it a few years ago on stars in Orion’s Nebula).

I’m really struggling to find a FITS image of the whole cloud as I’m still a bit new to archives and stuff. I’d like it to be in visual wavelengths if possible...can anyone help? It would really help me out! ","SMC FITS File? Hi everyone, 
I’m currently doing a research project on supernovae in the Small Magellanic  Cloud. I’m trying to find a FITS image of the whole SMC, to then plot the SNe locations on (I’ve already got the code - I used it a few years ago on stars in Orion’s Nebula).

I’m really struggling to find a FITS image of the whole cloud as I’m still a bit new to archives and stuff. I’d like it to be in visual wavelengths if possible...can anyone help? It would really help me out! "
Moon 17.02.2019,,Moon 17.02.2019 
The Hidden Galaxy - A galaxy obscured by dust near the galactic equator from the Milky Way,,The Hidden Galaxy - A galaxy obscured by dust near the galactic equator from the Milky Way 
Sh2-284 in Monceros : Presented in SHO Narrowband,,Sh2-284 in Monceros : Presented in SHO Narrowband 
Good places to get a view in Minnesota?,"I live in a very light polluted place near the city in the suburbs. I have a 10” dob thru which all I can see is the moon, the planets, and a few stars because of my location. I really want to go somewhere in the state (or nearby states)  that’s not too far away from the general Minneapolis region. Any and all ideas are appreciated!","Good places to get a view in Minnesota? I live in a very light polluted place near the city in the suburbs. I have a 10” dob thru which all I can see is the moon, the planets, and a few stars because of my location. I really want to go somewhere in the state (or nearby states)  that’s not too far away from the general Minneapolis region. Any and all ideas are appreciated!"
Clear Dark Sky app?,"My old Android phone died last week, and dutifully replaced it. One app I haven't been able to find is an app which provides the charts from cleardarksky.com.

I see there's one for iPhones (ICSC, IIRC) but the Clear Dark Sky app has vanished. Is there anything like this app/site for Android?","Clear Dark Sky app? My old Android phone died last week, and dutifully replaced it. One app I haven't been able to find is an app which provides the charts from cleardarksky.com.

I see there's one for iPhones (ICSC, IIRC) but the Clear Dark Sky app has vanished. Is there anything like this app/site for Android?"
A River of Stars: astronomers discover a nearby stellar stream,,A River of Stars: astronomers discover a nearby stellar stream 
"Orion and the Horsehead from Hawaii, 2/8/19",,"Orion and the Horsehead from Hawaii, 2/8/19 "
Visited the VLA (Very Large Array) today and took a big-ass panoramic photo [17121x3478],,Visited the VLA (Very Large Array) today and took a big-ass panoramic photo [17121x3478] 
Anyone use telesope with SkyPortal? (Need help),"Hello,
 Does anyone use a telescope with an app called SkyPortal. I owm a Celestron Cosmos 90gt wifi telescope and i need to use the mobile app ""SkyPortal"" in order to control and align it.


So the problem im having is that when im gonna align it i dont find anyway to reset the last alignment and when i try to do it over it says something like "" alingment position 4/10"" when i just started it.... And when i select that position it tells me its too far from the location from the telescope. :( I need help please

","Anyone use telesope with SkyPortal? (Need help) Hello,
 Does anyone use a telescope with an app called SkyPortal. I owm a Celestron Cosmos 90gt wifi telescope and i need to use the mobile app ""SkyPortal"" in order to control and align it.


So the problem im having is that when im gonna align it i dont find anyway to reset the last alignment and when i try to do it over it says something like "" alingment position 4/10"" when i just started it.... And when i select that position it tells me its too far from the location from the telescope. :( I need help please

"
Galaxy NGC 772 (Arp 78),,Galaxy NGC 772 (Arp 78) 
Deep learning opens a new kind of noise reduction,,Deep learning opens a new kind of noise reduction 
Chandra finds missing component of baryonic matter,,Chandra finds missing component of baryonic matter 
Living on the Edge: Stars Found Far from Galaxy Center,,Living on the Edge: Stars Found Far from Galaxy Center 
Questions about Earth's precession,"I have been studying astronomy at home by myself and I can't wrap my head around understanding the Earth's precession (even after trying to figure it out using google and my astronomy book). I understand that a tropical year is \~365.2422 solar days and a sidereal year is \~365.256 solar days so there is about a 20 minute difference.  

\- Does this mean that constellations are slowly moving eastward, kind of ""falling back"" at a rate of 20 mins a year? E.g. Orion would rise 20 mins later every year on the same calendar day?

\- How do leap-years come into play?  (If they have any effect at all on this?) 

\- My astronomy book states that Orion will be a summer constellation in 13000 years. Could anyone explain the math behind this? It is probably a bad example as a complete cycle of precession is 26000 years and so if it is now a winter constellation (in the northern hemisphere) I kind of expect it to be a summer constellation half-way through the cycle. Is it as simple as assuming 26000 years is a 360° circle and calculating proportions if I want to calculate this for other constellations? What is the relationship between the 26000 year period and the 20 minutes difference per day?

&amp;#x200B;

Thanks in advance to anyone who takes the time to read / answer my questions.

&amp;#x200B;","Questions about Earth's precession I have been studying astronomy at home by myself and I can't wrap my head around understanding the Earth's precession (even after trying to figure it out using google and my astronomy book). I understand that a tropical year is \~365.2422 solar days and a sidereal year is \~365.256 solar days so there is about a 20 minute difference.  

\- Does this mean that constellations are slowly moving eastward, kind of ""falling back"" at a rate of 20 mins a year? E.g. Orion would rise 20 mins later every year on the same calendar day?

\- How do leap-years come into play?  (If they have any effect at all on this?) 

\- My astronomy book states that Orion will be a summer constellation in 13000 years. Could anyone explain the math behind this? It is probably a bad example as a complete cycle of precession is 26000 years and so if it is now a winter constellation (in the northern hemisphere) I kind of expect it to be a summer constellation half-way through the cycle. Is it as simple as assuming 26000 years is a 360° circle and calculating proportions if I want to calculate this for other constellations? What is the relationship between the 26000 year period and the 20 minutes difference per day?

&amp;#x200B;

Thanks in advance to anyone who takes the time to read / answer my questions.

&amp;#x200B;"
"Star trail photos taken from earth appear as almost perfect circles only because earth is too far from the stars and the distance the earth travels in orbit during the long exposure is negligible from the perspective of distant stars, correct?","Otherwise, we wont get star trails in almost perfect circles, correct?

[star trails](https://earthsky.org/astronomy-essentials/what-are-star-trails) ","Star trail photos taken from earth appear as almost perfect circles only because earth is too far from the stars and the distance the earth travels in orbit during the long exposure is negligible from the perspective of distant stars, correct? Otherwise, we wont get star trails in almost perfect circles, correct?

[star trails](https://earthsky.org/astronomy-essentials/what-are-star-trails) "
Where in the world can I take a short break to get the best view of space?,"My 40th birthday is in late July and I’m thinking I’d really like to take myself and some friends to witness the awesomeness of the stars and galaxies beyond. 

I live in the UK but am willing to travel. But I’ve no idea where to even start. I’m hoping /r/astronomy can help me out and give me some ideas around the best places to visit for a short package type trip to witness the best views of space available in Europe. 

If there’s a helpful guide with a telescope thrown in, then even better! 

Thanks everyone. ","Where in the world can I take a short break to get the best view of space? My 40th birthday is in late July and I’m thinking I’d really like to take myself and some friends to witness the awesomeness of the stars and galaxies beyond. 

I live in the UK but am willing to travel. But I’ve no idea where to even start. I’m hoping /r/astronomy can help me out and give me some ideas around the best places to visit for a short package type trip to witness the best views of space available in Europe. 

If there’s a helpful guide with a telescope thrown in, then even better! 

Thanks everyone. "
"I'm loving the sky views I get with EAA.. short exposures and no post-processing for a pretty awesome ""live view""",,"I'm loving the sky views I get with EAA.. short exposures and no post-processing for a pretty awesome ""live view"" "
"Measurements of gravitational waves over the coming decades will settle the debate over how fast the Universe is expanding, new research suggests.",,"Measurements of gravitational waves over the coming decades will settle the debate over how fast the Universe is expanding, new research suggests. "
Galaxy NGC 2403 in the Constellation Camelopardalis,,Galaxy NGC 2403 in the Constellation Camelopardalis 
NASA Selects New Mission to Explore Origins of Universe,,NASA Selects New Mission to Explore Origins of Universe 
"February 13, 2004 – The Harvard–Smithsonian Center for Astrophysics announces the discovery of ""Lucy"" the universe's largest known diamond, white dwarf star BPM 37093. Astronomers named this star ""Lucy"" after The Beatles' song ""Lucy in the Sky with Diamonds"".",,"February 13, 2004 – The Harvard–Smithsonian Center for Astrophysics announces the discovery of ""Lucy"" the universe's largest known diamond, white dwarf star BPM 37093. Astronomers named this star ""Lucy"" after The Beatles' song ""Lucy in the Sky with Diamonds"". "
"Will Sirius Disappear on February 18th? - On Monday night observers in parts of Mexico, the western U.S., and central Canada may see the occultation of a lifetime when a tiny asteroid momentarily blots out the night sky's brightest star",,"Will Sirius Disappear on February 18th? - On Monday night observers in parts of Mexico, the western U.S., and central Canada may see the occultation of a lifetime when a tiny asteroid momentarily blots out the night sky's brightest star "
Do planets in our solar system ever transit each other?,"It seems like it would be a simple question to find the answer to but all my google searches only yield results about planets transitting the sun or earth transitting the sun from the POV of the other planet.  Do planets ever pass in front of each other from Earth's perspective?  If so, please link any information you can find about what it's called or how to determine when these events would occur!","Do planets in our solar system ever transit each other? It seems like it would be a simple question to find the answer to but all my google searches only yield results about planets transitting the sun or earth transitting the sun from the POV of the other planet.  Do planets ever pass in front of each other from Earth's perspective?  If so, please link any information you can find about what it's called or how to determine when these events would occur!"
James Clerk Maxwell Telescope discovers flare 10 billion times more powerful than those on the sun,,James Clerk Maxwell Telescope discovers flare 10 billion times more powerful than those on the sun 
"Anyone star gazed around Breckenridge, CO?",I am taking a trip there in June and wanted to drive out somewhere fairly close to star gaze with my kids. I live in a fairly LP area and wanted my kids to experience what the night sky can really look like. The problem is that I am not sure where to actually go? And I am also not sure if all of the pull offs on some of the historic / scenic area's are OK to hang out at after dark. Anyone here familiar with that area?,"Anyone star gazed around Breckenridge, CO? I am taking a trip there in June and wanted to drive out somewhere fairly close to star gaze with my kids. I live in a fairly LP area and wanted my kids to experience what the night sky can really look like. The problem is that I am not sure where to actually go? And I am also not sure if all of the pull offs on some of the historic / scenic area's are OK to hang out at after dark. Anyone here familiar with that area?"
ISS lunar transit - close up,,ISS lunar transit - close up 
Kepler's Laws interactive simulation/visualization tool,,Kepler's Laws interactive simulation/visualization tool 
What is your favorite upcoming astronomy project?,"For me, it would have to be the E-ELT.   


My primary love in astronomy always were exoplanets and seeing how we will be getting a large tool with exoplanets in mind, one that will have the ability to do spectroscopic analysis of these planets is just mind boggling.  


&amp;#x200B;","What is your favorite upcoming astronomy project? For me, it would have to be the E-ELT.   


My primary love in astronomy always were exoplanets and seeing how we will be getting a large tool with exoplanets in mind, one that will have the ability to do spectroscopic analysis of these planets is just mind boggling.  


&amp;#x200B;"
Messier 35 and NGC 2158 in Gemini,,Messier 35 and NGC 2158 in Gemini 
How to See Comet Iwamoto Fly Past Earth This Week,,How to See Comet Iwamoto Fly Past Earth This Week 
The Butterfly Nebula - IC1318,,The Butterfly Nebula - IC1318 
Star &amp; Crossbones Nebula [OC] 27 hour exposure,,Star &amp; Crossbones Nebula [OC] 27 hour exposure 
"Looking for folklore, legends, and myths and astronomy","First off, I looked through the purchase suggestion megathread, and none of the books seemed to match what I'm looking for.

&amp;#x200B;

When I was 13 I did the astronomy merit badge as a Boy Scout. I haven't devoted much time, energy, or money into astronomy, but I love taking family and friends out in the desert and enjoying the night sky. 

&amp;#x200B;

As part of this merit badge our instructor had a myth, folklore, legend, or story for every constellation we looked at. Do any of you have any recommendations on a book that would have these kinds of stories? ","Looking for folklore, legends, and myths and astronomy First off, I looked through the purchase suggestion megathread, and none of the books seemed to match what I'm looking for.

&amp;#x200B;

When I was 13 I did the astronomy merit badge as a Boy Scout. I haven't devoted much time, energy, or money into astronomy, but I love taking family and friends out in the desert and enjoying the night sky. 

&amp;#x200B;

As part of this merit badge our instructor had a myth, folklore, legend, or story for every constellation we looked at. Do any of you have any recommendations on a book that would have these kinds of stories? "
20 year old theory proved: Winds driven by a black hole could potentially carry gas and other star-making material thousands of light years away from their host galaxy.,,20 year old theory proved: Winds driven by a black hole could potentially carry gas and other star-making material thousands of light years away from their host galaxy. 
The Space Review: A helping hand for giant telescopes,,The Space Review: A helping hand for giant telescopes 
New research finds possible second impact crater hiding under Greenland ice,,New research finds possible second impact crater hiding under Greenland ice 
I detected exoplanet HD189733b with a tele-photo lens,,I detected exoplanet HD189733b with a tele-photo lens 
The Rosette Nebula [OC],,The Rosette Nebula [OC] 
Part of the Orion constellation,,Part of the Orion constellation 
Heart Nebula,,Heart Nebula 
NGC 5053 - Sparse Globular Cluster,,NGC 5053 - Sparse Globular Cluster 
Winter Stars Over the Dark Side Observatory,,Winter Stars Over the Dark Side Observatory 
"ALMA Observatory captured this spiral nebula around the red giant star R Sculptoris that located about 1,500 light-years away toward the constellation Sculptor. Credit:ESO,NAOJ,NRAO.",,"ALMA Observatory captured this spiral nebula around the red giant star R Sculptoris that located about 1,500 light-years away toward the constellation Sculptor. Credit:ESO,NAOJ,NRAO. "
Because I know you’ll understand my pain ...,"I was just chatting with my dad about how I’d like to build my own telescope someday. He said “I was just at an estate sale and they had this *huge* telescope. It was crazy!” and described what sounded a lot like a ~12” homemade dobsonian.

I asked him where it was and rushed over, figuring if it was an estate sale, they might not know what they have.

I get there and look around, but don’t see it, so I ask. 

“Yeah, it sold a little bit ago.”

“Out of curiosity, how much?”

“$30.”

“Oh. Okay … thanks.”

😩","Because I know you’ll understand my pain ... I was just chatting with my dad about how I’d like to build my own telescope someday. He said “I was just at an estate sale and they had this *huge* telescope. It was crazy!” and described what sounded a lot like a ~12” homemade dobsonian.

I asked him where it was and rushed over, figuring if it was an estate sale, they might not know what they have.

I get there and look around, but don’t see it, so I ask. 

“Yeah, it sold a little bit ago.”

“Out of curiosity, how much?”

“$30.”

“Oh. Okay … thanks.”

😩"
Hubble Sets Its Sights on the Ice Giants,,Hubble Sets Its Sights on the Ice Giants 
Silent space,If there's an explosion in space can it be heard? I was thinking no because space is a vacuum.,Silent space If there's an explosion in space can it be heard? I was thinking no because space is a vacuum.
Rosette Nebula [OC],,Rosette Nebula [OC] 
M51 [OC],,M51 [OC] 
